{
  "artifacts": [
    {
      "exists": true,
      "kind": "trajectory",
      "path": "target\\euroc_keyframe_policy_ba_ratio05_floor50_ab\\MH_03_medium\\tracked_drop\\slam_trajectory.csv",
      "sha256": "348250094ae60c902cee0c35d2006e36b76a2ba3a2b9a92ba648294c66825f4f"
    },
    {
      "exists": true,
      "kind": "errors",
      "path": "target\\euroc_keyframe_policy_ba_ratio05_floor50_ab\\MH_03_medium\\tracked_drop\\slam_errors.csv",
      "sha256": "2dfbfbd86b332e6c835b1dfdea02003fb4cb8cb7bb7a73645d0ea887a7357b93"
    },
    {
      "exists": true,
      "kind": "summary",
      "path": "target\\euroc_keyframe_policy_ba_ratio05_floor50_ab\\MH_03_medium\\tracked_drop\\summary.txt",
      "sha256": "5e7fab2bf221f68bb86ca630b5129ef15b935cd5171fc1aef164fce469e5e825"
    },
    {
      "exists": true,
      "kind": "keyframe_decisions",
      "path": "target\\euroc_keyframe_policy_ba_ratio05_floor50_ab\\MH_03_medium\\tracked_drop\\keyframe_decisions.csv",
      "sha256": "9821166ce66f1ef3384257bee9f604aa88feb360f46b3a96bc2bcebe62902e5e"
    },
    {
      "exists": true,
      "kind": "covisibility_ba_log",
      "path": "target\\euroc_keyframe_policy_ba_ratio05_floor50_ab\\MH_03_medium\\tracked_drop\\covisibility_ba_log.txt",
      "sha256": "900fc8bee39b5c12f7a38120bb6816c13cea4dd807897eb9ef5778d897f99368"
    }
  ],
  "benchmark": {
    "docs": [
      "docs/motion_based_vi_alignment.md"
    ],
    "id": "euroc-keyframe-tracked-landmark-drop",
    "name": "EuRoC online SLAM tracked-landmark keyframe policy A/B",
    "protocol": "fixed/tracked-drop SimpleKeyframePolicy A/B on identical EuRoC image/IMU command",
    "script": "examples/euroc_online_slam_vi_image_demo.rs"
  },
  "build": {
    "cargo": null,
    "cargo_lock_sha256": "c4c1aaea1dad9da8f7ebaf46e635431b518eae7658fb662638281164d1c0616e",
    "features": [
      "image-io"
    ],
    "profile": "release",
    "rustc": null,
    "target": null
  },
  "claim_scope": "exploratory",
  "command": {
    "argv": [
      "C:\\Users\\rsasa\\.cargo\\bin\\cargo.exe",
      "run",
      "--release",
      "--features",
      "image-io",
      "--example",
      "euroc_online_slam_vi_image_demo",
      "--",
      "--euroc-dir",
      "C:\\Users\\rsasa\\Workspace\\old\\simple_visual_slam\\euroc_mav\\machine_hall\\machine_hall\\MH_03_medium",
      "--out-dir",
      "target\\euroc_keyframe_policy_ba_ratio05_floor50_ab\\MH_03_medium\\tracked_drop",
      "--max-frames",
      "400",
      "--gravity",
      "0,0,-9.81",
      "--keyframe-min-translation",
      "0.1",
      "--covisibility-local-ba",
      "--covisibility-local-ba-min-keyframes",
      "3",
      "--covisibility-local-ba-trigger-every",
      "1",
      "--covisibility-local-ba-max-landmarks",
      "200",
      "--covisibility-local-ba-outlier-threshold-px",
      "5.0",
      "--keyframe-tracked-landmark-ratio",
      "0.5",
      "--keyframe-min-tracked-landmarks-for-ratio",
      "50"
    ],
    "cwd": "C:\\Users\\rsasa\\Workspace\\visloc-rs",
    "raw": "'C:\\Users\\rsasa\\.cargo\\bin\\cargo.exe' run --release --features image-io --example euroc_online_slam_vi_image_demo -- --euroc-dir 'C:\\Users\\rsasa\\Workspace\\old\\simple_visual_slam\\euroc_mav\\machine_hall\\machine_hall\\MH_03_medium' --out-dir 'target\\euroc_keyframe_policy_ba_ratio05_floor50_ab\\MH_03_medium\\tracked_drop' --max-frames 400 --gravity 0,0,-9.81 --keyframe-min-translation 0.1 --covisibility-local-ba --covisibility-local-ba-min-keyframes 3 --covisibility-local-ba-trigger-every 1 --covisibility-local-ba-max-landmarks 200 --covisibility-local-ba-outlier-threshold-px 5.0 --keyframe-tracked-landmark-ratio 0.5 --keyframe-min-tracked-landmarks-for-ratio 50"
  },
  "config": {
    "config_files": [],
    "params": {
      "demo_args": "--gravity 0,0,-9.81 --keyframe-min-translation 0.1 --covisibility-local-ba --covisibility-local-ba-min-keyframes 3 --covisibility-local-ba-trigger-every 1 --covisibility-local-ba-max-landmarks 200 --covisibility-local-ba-outlier-threshold-px 5.0",
      "max_frames": 400,
      "min_tracked_landmarks": 50,
      "tracked_landmark_ratio": 0.5,
      "variant": "tracked_drop"
    },
    "seed": null
  },
  "created_utc": "2026-06-19T10:49:53Z",
  "dataset": {
    "checksum": null,
    "checksum_method": null,
    "name": "EuRoC MAV",
    "path": "C:\\Users\\rsasa\\Workspace\\old\\simple_visual_slam\\euroc_mav\\machine_hall\\machine_hall\\MH_03_medium",
    "sequence": "MH_03_medium",
    "version": "ASL EuRoC MAV dataset"
  },
  "failure_reason": null,
  "git": {
    "branch": "main",
    "commit": "eb7242e21ad560737809160ab6e1a8d5cf1cb4a5",
    "dirty": true
  },
  "hardware": {
    "gpu": null,
    "hostname": "DESKTOP-PTSK105",
    "machine": "AMD64",
    "notes": null,
    "os": "Windows-11-10.0.26300-SP0",
    "processor": "Intel64 Family 6 Model 158 Stepping 10, GenuineIntel"
  },
  "metrics": [
    {
      "implementation": null,
      "name": "ate_rigid_rmse_m",
      "primary": true,
      "source_artifact": null,
      "unit": "m",
      "value": 1.6581
    },
    {
      "implementation": null,
      "name": "ate_similarity_rmse_m",
      "primary": false,
      "source_artifact": null,
      "unit": "m",
      "value": 0.1601
    },
    {
      "implementation": null,
      "name": "tracking_success_rate",
      "primary": false,
      "source_artifact": null,
      "unit": "ratio",
      "value": 0.802
    },
    {
      "implementation": null,
      "name": "frames_recorded",
      "primary": false,
      "source_artifact": null,
      "unit": "count",
      "value": 400
    },
    {
      "implementation": null,
      "name": "map_keyframes",
      "primary": false,
      "source_artifact": null,
      "unit": "count",
      "value": 68
    },
    {
      "implementation": null,
      "name": "map_landmarks",
      "primary": false,
      "source_artifact": null,
      "unit": "count",
      "value": 1500
    },
    {
      "implementation": null,
      "name": "imu_factors_staged",
      "primary": false,
      "source_artifact": null,
      "unit": "count",
      "value": 48
    },
    {
      "implementation": null,
      "name": "local_vi_ba_triggers",
      "primary": false,
      "source_artifact": null,
      "unit": "count",
      "value": 0
    },
    {
      "implementation": null,
      "name": "covisibility_local_ba_triggers",
      "primary": false,
      "source_artifact": null,
      "unit": "count",
      "value": 66
    },
    {
      "implementation": null,
      "name": "covisibility_local_map_used_frames",
      "primary": false,
      "source_artifact": null,
      "unit": "count",
      "value": 0
    },
    {
      "implementation": null,
      "name": "covisibility_local_map_mean_size",
      "primary": false,
      "source_artifact": null,
      "unit": "count",
      "value": 0.0
    },
    {
      "implementation": null,
      "name": "keyframe_decision_rows",
      "primary": false,
      "source_artifact": null,
      "unit": "count",
      "value": 400
    },
    {
      "implementation": null,
      "name": "keyframe_selected_count",
      "primary": false,
      "source_artifact": null,
      "unit": "count",
      "value": 68
    },
    {
      "implementation": null,
      "name": "keyframe_tracked_landmark_drop_count",
      "primary": false,
      "source_artifact": null,
      "unit": "count",
      "value": 7
    },
    {
      "implementation": null,
      "name": "keyframe_thresholds_met_count",
      "primary": false,
      "source_artifact": null,
      "unit": "count",
      "value": 50
    },
    {
      "implementation": null,
      "name": "keyframe_relocalized_count",
      "primary": false,
      "source_artifact": null,
      "unit": "count",
      "value": 10
    },
    {
      "implementation": null,
      "name": "keyframe_translation_too_small_count",
      "primary": false,
      "source_artifact": null,
      "unit": "count",
      "value": 34
    },
    {
      "implementation": null,
      "name": "keyframe_frame_gap_too_small_count",
      "primary": false,
      "source_artifact": null,
      "unit": "count",
      "value": 219
    },
    {
      "implementation": null,
      "name": "keyframe_no_mapping_count",
      "primary": false,
      "source_artifact": null,
      "unit": "count",
      "value": 79
    }
  ],
  "models": [],
  "notes": null,
  "result_kind": "visloc_run",
  "run_id": "euroc-keyframe-tracked-landmark-drop-MH_03_medium-tracked_drop-20260619T104936Z",
  "schema_version": 1,
  "status": "success"
}
