{
  "artifacts": [
    {
      "exists": true,
      "kind": "trajectory",
      "path": "target\\tight_vio_gate_smoke\\MH_01_easy\\gated\\slam_trajectory.csv",
      "sha256": "dc5ded2d7c3445ed8eab317f4defbedbfa99328431867952b7801f99978e3286"
    },
    {
      "exists": true,
      "kind": "errors",
      "path": "target\\tight_vio_gate_smoke\\MH_01_easy\\gated\\slam_errors.csv",
      "sha256": "4f16c1f2169b5e38288078a3342384a9b71d5fa28ce5e4c6c6c0c616520a4e95"
    },
    {
      "exists": true,
      "kind": "summary",
      "path": "target\\tight_vio_gate_smoke\\MH_01_easy\\gated\\summary.txt",
      "sha256": "4c8347b6aa0b4526a4d4bfcf9910135b171dd3d9b9bb9c5861e6ca4cb16c2aa7"
    },
    {
      "exists": true,
      "kind": "vi_init_log",
      "path": "target\\tight_vio_gate_smoke\\MH_01_easy\\gated\\vi_init_log.txt",
      "sha256": "fa4e5fc333e007a5840d2153ba6ecc8c979e92e103c207e898930a90bde5cb63"
    },
    {
      "exists": true,
      "kind": "motion_vi_init_log",
      "path": "target\\tight_vio_gate_smoke\\MH_01_easy\\gated\\motion_vi_init_log.txt",
      "sha256": "5823e4e41936f8f4ab7976e171283c0a30d48506048b7fde8c61950a1195dfad"
    },
    {
      "exists": true,
      "kind": "keyframe_decisions",
      "path": "target\\tight_vio_gate_smoke\\MH_01_easy\\gated\\keyframe_decisions.csv",
      "sha256": "99db456ac613e60c9bac8b294c881cfcfea6b85107720bd907020646388e82a0"
    }
  ],
  "benchmark": {
    "docs": [
      "docs/motion_based_vi_alignment.md"
    ],
    "id": "euroc-tight-vio-local-ba-gates",
    "name": "EuRoC tight VIO local BA writeback gates smoke",
    "protocol": "MH_01_easy 400-frame HOG/cross-check local-VI-BA smoke; compare local VI-BA writeback gates",
    "script": "examples/euroc_online_slam_vi_image_demo.rs"
  },
  "build": {
    "cargo": "cargo 1.94.0 (85eff7c80 2026-01-15)",
    "cargo_lock_sha256": "c4c1aaea1dad9da8f7ebaf46e635431b518eae7658fb662638281164d1c0616e",
    "features": [
      "image-io"
    ],
    "profile": "release",
    "rustc": "rustc 1.94.0 (4a4ef493e 2026-03-02)",
    "target": null
  },
  "claim_scope": "exploratory",
  "command": {
    "argv": [
      ".\\target\\release\\examples\\euroc_online_slam_vi_image_demo.exe",
      "--euroc-dir",
      "C:\\Users\\rsasa\\Workspace\\old\\simple_visual_slam\\euroc_mav\\machine_hall\\machine_hall\\MH_01_easy",
      "--out-dir",
      "target\\tight_vio_gate_smoke\\MH_01_easy\\gated",
      "--max-frames",
      "400",
      "--motion-vi-init",
      "--local-vi-ba",
      "--covisibility-local-map-max-keyframes",
      "10",
      "--covisibility-local-map-min-shared",
      "15",
      "--max-pose-jump-meters",
      "0.2",
      "--motion-model",
      "imu",
      "--pnp-pose-prior-warm-start",
      "--vi-init-gyro-std-limit",
      "0.5",
      "--vi-init-accel-std-limit",
      "5.0",
      "--feature-extractor",
      "hog",
      "--cross-check-matcher",
      "--keyframe-min-translation",
      "0.1",
      "--keep-pre-promotion-imu-factors",
      "--relinearise-imu-factor-bias-thresholds",
      "0.01,0.1",
      "--local-vi-ba-reject-writeback-above",
      "1.0",
      "--local-vi-ba-reject-velocity-above",
      "10.0"
    ],
    "cwd": "C:\\Users\\rsasa\\Workspace\\visloc-rs",
    "raw": "'.\\target\\release\\examples\\euroc_online_slam_vi_image_demo.exe' --euroc-dir 'C:\\Users\\rsasa\\Workspace\\old\\simple_visual_slam\\euroc_mav\\machine_hall\\machine_hall\\MH_01_easy' --out-dir 'target\\tight_vio_gate_smoke\\MH_01_easy\\gated' --max-frames 400 --motion-vi-init --local-vi-ba --covisibility-local-map-max-keyframes 10 --covisibility-local-map-min-shared 15 --max-pose-jump-meters 0.2 --motion-model imu --pnp-pose-prior-warm-start --vi-init-gyro-std-limit 0.5 --vi-init-accel-std-limit 5.0 --feature-extractor hog --cross-check-matcher --keyframe-min-translation 0.1 --keep-pre-promotion-imu-factors --relinearise-imu-factor-bias-thresholds 0.01,0.1 --local-vi-ba-reject-writeback-above 1.0 --local-vi-ba-reject-velocity-above 10.0"
  },
  "config": {
    "config_files": [],
    "params": {
      "demo_args": "--max-frames 400 --motion-vi-init --local-vi-ba --covisibility-local-map-max-keyframes 10 --covisibility-local-map-min-shared 15 --max-pose-jump-meters 0.2 --motion-model imu --pnp-pose-prior-warm-start --vi-init-gyro-std-limit 0.5 --vi-init-accel-std-limit 5.0 --feature-extractor hog --cross-check-matcher --keyframe-min-translation 0.1 --keep-pre-promotion-imu-factors --relinearise-imu-factor-bias-thresholds 0.01,0.1 --local-vi-ba-reject-writeback-above 1.0 --local-vi-ba-reject-velocity-above 10.0",
      "local_vi_ba_reject_velocity_above_mps": 10.0,
      "local_vi_ba_reject_writeback_above": 1.0,
      "max_frames": 400,
      "variant": "gated_10mps"
    },
    "seed": null
  },
  "created_utc": "2026-06-20T08:47:38Z",
  "dataset": {
    "checksum": "ca18bb77e66e0244f37afd4c3f6e5c9c1184df320ad959b22877e0640496143c",
    "checksum_method": "sha256_tree_v1",
    "name": "EuRoC MAV",
    "path": "C:\\Users\\rsasa\\Workspace\\old\\simple_visual_slam\\euroc_mav\\machine_hall\\machine_hall\\MH_01_easy",
    "sequence": "MH_01_easy",
    "version": "ASL EuRoC MAV dataset"
  },
  "failure_reason": null,
  "git": {
    "branch": "main",
    "commit": "eb7242e21ad560737809160ab6e1a8d5cf1cb4a5",
    "dirty": true
  },
  "hardware": {
    "gpu": null,
    "hostname": "DESKTOP-PTSK105",
    "machine": "AMD64",
    "notes": null,
    "os": "Windows-11-10.0.26300-SP0",
    "processor": "Intel64 Family 6 Model 158 Stepping 10, GenuineIntel"
  },
  "metrics": [
    {
      "implementation": null,
      "name": "ate_rigid_rmse_m",
      "primary": true,
      "source_artifact": null,
      "unit": "m",
      "value": 0.0692
    },
    {
      "implementation": null,
      "name": "ate_similarity_rmse_m",
      "primary": false,
      "source_artifact": null,
      "unit": "m",
      "value": 0.0681
    },
    {
      "implementation": null,
      "name": "ate_similarity_scale",
      "primary": false,
      "source_artifact": null,
      "unit": "ratio",
      "value": 1.108335
    },
    {
      "implementation": null,
      "name": "tracking_success_rate",
      "primary": false,
      "source_artifact": null,
      "unit": "ratio",
      "value": 0.08
    },
    {
      "implementation": null,
      "name": "map_keyframes",
      "primary": false,
      "source_artifact": null,
      "unit": "count",
      "value": 7
    },
    {
      "implementation": null,
      "name": "imu_factors_staged",
      "primary": false,
      "source_artifact": null,
      "unit": "count",
      "value": 6
    },
    {
      "implementation": null,
      "name": "local_vi_ba_triggers",
      "primary": false,
      "source_artifact": null,
      "unit": "count",
      "value": 1
    },
    {
      "implementation": null,
      "name": "local_vi_ba_quality_gate_rejections",
      "primary": false,
      "source_artifact": null,
      "unit": "count",
      "value": 0
    },
    {
      "implementation": null,
      "name": "local_vi_ba_cost_ratio_gate_rejections",
      "primary": false,
      "source_artifact": null,
      "unit": "count",
      "value": 0
    },
    {
      "implementation": null,
      "name": "local_vi_ba_velocity_gate_rejections",
      "primary": false,
      "source_artifact": null,
      "unit": "count",
      "value": 0
    },
    {
      "implementation": null,
      "name": "local_vi_ba_mirrors_into_imu_motion_model",
      "primary": false,
      "source_artifact": null,
      "unit": "count",
      "value": 1
    }
  ],
  "models": [],
  "notes": "Exploratory smoke for local VI-BA writeback gates. The 1 m/s cap is an intentional tripwire, not a recommended production threshold.",
  "result_kind": "exploratory",
  "run_id": "euroc-tight-vio-gate-MH_01_easy-gated_10mps-20260620",
  "schema_version": 1,
  "status": "success"
}
