{
  "artifacts": [
    {
      "exists": true,
      "kind": "trajectory",
      "path": "target\\euroc_keyframe_policy_ab\\MH_05_difficult\\tracked_drop\\slam_trajectory.csv",
      "sha256": "82e4069aa46c33228f52b27036bb99f5af2a94f711c6d00eeb08813c13f8cc79"
    },
    {
      "exists": true,
      "kind": "errors",
      "path": "target\\euroc_keyframe_policy_ab\\MH_05_difficult\\tracked_drop\\slam_errors.csv",
      "sha256": "afb3acd325746f0f633c2278d6b63a4e52a4642e82a3a9ee465a012f8960b9eb"
    },
    {
      "exists": true,
      "kind": "summary",
      "path": "target\\euroc_keyframe_policy_ab\\MH_05_difficult\\tracked_drop\\summary.txt",
      "sha256": "b2ab3c12af3def950412dd66afc39d0006bd56addf8e7fe1c41c7afb2b57172d"
    },
    {
      "exists": true,
      "kind": "keyframe_decisions",
      "path": "target\\euroc_keyframe_policy_ab\\MH_05_difficult\\tracked_drop\\keyframe_decisions.csv",
      "sha256": "b2acbec8e8e9a6ca65c9d4609a5b6c06a548c13a3f1ac084efffd23090850c56"
    },
    {
      "exists": true,
      "kind": "covisibility_ba_log",
      "path": "target\\euroc_keyframe_policy_ab\\MH_05_difficult\\tracked_drop\\covisibility_ba_log.txt",
      "sha256": "07c6c287564a012aff78dc1f671769c9430e269da3ad8282fb161efe4a0363db"
    }
  ],
  "benchmark": {
    "docs": [
      "docs/motion_based_vi_alignment.md"
    ],
    "id": "euroc-keyframe-tracked-landmark-drop",
    "name": "EuRoC online SLAM tracked-landmark keyframe policy A/B",
    "protocol": "fixed/tracked-drop SimpleKeyframePolicy A/B on identical EuRoC image/IMU command",
    "script": "examples/euroc_online_slam_vi_image_demo.rs"
  },
  "build": {
    "cargo": null,
    "cargo_lock_sha256": "c4c1aaea1dad9da8f7ebaf46e635431b518eae7658fb662638281164d1c0616e",
    "features": [
      "image-io"
    ],
    "profile": "release",
    "rustc": null,
    "target": null
  },
  "claim_scope": "exploratory",
  "command": {
    "argv": [
      "C:\\Users\\rsasa\\.cargo\\bin\\cargo.exe",
      "run",
      "--release",
      "--features",
      "image-io",
      "--example",
      "euroc_online_slam_vi_image_demo",
      "--",
      "--euroc-dir",
      "C:\\Users\\rsasa\\Workspace\\old\\simple_visual_slam\\euroc_mav\\machine_hall\\machine_hall\\MH_05_difficult",
      "--out-dir",
      "target\\euroc_keyframe_policy_ab\\MH_05_difficult\\tracked_drop",
      "--max-frames",
      "400",
      "--gravity",
      "0,0,-9.81",
      "--keyframe-min-translation",
      "0.1",
      "--keyframe-tracked-landmark-ratio",
      "0.9",
      "--keyframe-min-tracked-landmarks-for-ratio",
      "20"
    ],
    "cwd": "C:\\Users\\rsasa\\Workspace\\visloc-rs",
    "raw": "'C:\\Users\\rsasa\\.cargo\\bin\\cargo.exe' run --release --features image-io --example euroc_online_slam_vi_image_demo -- --euroc-dir 'C:\\Users\\rsasa\\Workspace\\old\\simple_visual_slam\\euroc_mav\\machine_hall\\machine_hall\\MH_05_difficult' --out-dir 'target\\euroc_keyframe_policy_ab\\MH_05_difficult\\tracked_drop' --max-frames 400 --gravity 0,0,-9.81 --keyframe-min-translation 0.1 --keyframe-tracked-landmark-ratio 0.9 --keyframe-min-tracked-landmarks-for-ratio 20"
  },
  "config": {
    "config_files": [],
    "params": {
      "demo_args": "--gravity 0,0,-9.81 --keyframe-min-translation 0.1",
      "max_frames": 400,
      "min_tracked_landmarks": 20,
      "tracked_landmark_ratio": 0.9,
      "variant": "tracked_drop"
    },
    "seed": null
  },
  "created_utc": "2026-06-19T10:30:14Z",
  "dataset": {
    "checksum": null,
    "checksum_method": null,
    "name": "EuRoC MAV",
    "path": "C:\\Users\\rsasa\\Workspace\\old\\simple_visual_slam\\euroc_mav\\machine_hall\\machine_hall\\MH_05_difficult",
    "sequence": "MH_05_difficult",
    "version": "ASL EuRoC MAV dataset"
  },
  "failure_reason": null,
  "git": {
    "branch": "main",
    "commit": "eb7242e21ad560737809160ab6e1a8d5cf1cb4a5",
    "dirty": true
  },
  "hardware": {
    "gpu": null,
    "hostname": "DESKTOP-PTSK105",
    "machine": "AMD64",
    "notes": null,
    "os": "Windows-11-10.0.26300-SP0",
    "processor": "Intel64 Family 6 Model 158 Stepping 10, GenuineIntel"
  },
  "metrics": [
    {
      "implementation": null,
      "name": "ate_rigid_rmse_m",
      "primary": true,
      "source_artifact": null,
      "unit": "m",
      "value": 5.5694
    },
    {
      "implementation": null,
      "name": "ate_similarity_rmse_m",
      "primary": false,
      "source_artifact": null,
      "unit": "m",
      "value": 0.1414
    },
    {
      "implementation": null,
      "name": "tracking_success_rate",
      "primary": false,
      "source_artifact": null,
      "unit": "ratio",
      "value": 0.26
    },
    {
      "implementation": null,
      "name": "frames_recorded",
      "primary": false,
      "source_artifact": null,
      "unit": "count",
      "value": 400
    },
    {
      "implementation": null,
      "name": "map_keyframes",
      "primary": false,
      "source_artifact": null,
      "unit": "count",
      "value": 39
    },
    {
      "implementation": null,
      "name": "map_landmarks",
      "primary": false,
      "source_artifact": null,
      "unit": "count",
      "value": 1500
    },
    {
      "implementation": null,
      "name": "imu_factors_staged",
      "primary": false,
      "source_artifact": null,
      "unit": "count",
      "value": 36
    },
    {
      "implementation": null,
      "name": "local_vi_ba_triggers",
      "primary": false,
      "source_artifact": null,
      "unit": "count",
      "value": 0
    },
    {
      "implementation": null,
      "name": "covisibility_local_ba_triggers",
      "primary": false,
      "source_artifact": null,
      "unit": "count",
      "value": 0
    },
    {
      "implementation": null,
      "name": "covisibility_local_map_used_frames",
      "primary": false,
      "source_artifact": null,
      "unit": "count",
      "value": 0
    },
    {
      "implementation": null,
      "name": "covisibility_local_map_mean_size",
      "primary": false,
      "source_artifact": null,
      "unit": "count",
      "value": 0.0
    },
    {
      "implementation": null,
      "name": "keyframe_decision_rows",
      "primary": false,
      "source_artifact": null,
      "unit": "count",
      "value": 400
    },
    {
      "implementation": null,
      "name": "keyframe_selected_count",
      "primary": false,
      "source_artifact": null,
      "unit": "count",
      "value": 39
    },
    {
      "implementation": null,
      "name": "keyframe_tracked_landmark_drop_count",
      "primary": false,
      "source_artifact": null,
      "unit": "count",
      "value": 3
    },
    {
      "implementation": null,
      "name": "keyframe_thresholds_met_count",
      "primary": false,
      "source_artifact": null,
      "unit": "count",
      "value": 4
    },
    {
      "implementation": null,
      "name": "keyframe_relocalized_count",
      "primary": false,
      "source_artifact": null,
      "unit": "count",
      "value": 31
    },
    {
      "implementation": null,
      "name": "keyframe_translation_too_small_count",
      "primary": false,
      "source_artifact": null,
      "unit": "count",
      "value": 23
    },
    {
      "implementation": null,
      "name": "keyframe_frame_gap_too_small_count",
      "primary": false,
      "source_artifact": null,
      "unit": "count",
      "value": 42
    },
    {
      "implementation": null,
      "name": "keyframe_no_mapping_count",
      "primary": false,
      "source_artifact": null,
      "unit": "count",
      "value": 296
    }
  ],
  "models": [],
  "notes": null,
  "result_kind": "visloc_run",
  "run_id": "euroc-keyframe-tracked-landmark-drop-MH_05_difficult-tracked_drop-20260619T102840Z",
  "schema_version": 1,
  "status": "success"
}
